### ISSUE TITLE
Getting "Failed to connect"

### ISSUE THREAD

**Issue by ivaniotchenko** [Wouter0100/homeassistant-nanokvm#7]
Hello

thank you for your work on creating this addon! I'm looking forward to start using it, but getting the following error while trying to add my NanoKVM:
<img width="410" height="430" alt="Image" src="https://github.com/user-attachments/assets/28007d11-d704-4917-91e0-8d177b95b1dc" />

It was auto discovered by HAS and being added by mDNS name. Getting the same issue if adding using IP.

I tried to run tcpdump on a host with HAS VM - it shows successful authentication on nanokvm.

```
sudo tcpdump -i br0 host 192.168.1.249 -vvv
...
    192.168.1.249.http > homeassistant.43796: Flags [P.], cksum 0x97fd (correct), seq 1:298, ack 314, win 2027, options [nop,nop,TS val 2396908125 ecr 358384267], length 297: HTTP, length: 297
        HTTP/1.1 200 OK
        Content-Type: application/json; charset=utf-8
        Date: Thu, 08 Jan 1970 00:58:22 GMT
        Content-Length: 173
        {"code":0,"msg":"success","data":{"token":"eyJhbGciOiJIUtokenVCJ9.eyJ1c2VybmFtZStokenZXhwIjozMjg2NzAyfQ.liqHk-Pxn36yRLdltJ7_T4SsPPHlJxox7TsQ2rqaNsM"}} [|http]
19:20:36.803042 IP (tos 0x0, ttl 64, id 13889, offset 0, flags [DF], proto TCP (6), length 52)
    homeassistant.43796 > 192.168.1.249.http: Flags [.], cksum 0x8568 (incorrect -> 0x2593), seq 314, ack 298, win 501, options [nop,nop,TS val 358384954 ecr 2396908125], length 0
19:20:36.807276 IP (tos 0x0, ttl 64, id 13890, offset 0, flags [DF], proto TCP (6), length 381)
    homeassistant.43796 > 192.168.1.249.http: Flags [P.], cksum 0x86b1 (incorrect -> 0x3d94), seq 314:643, ack 298, win 501, options [nop,nop,TS val 358384958 ecr 2396908125], length 329: HTTP, length: 329
        GET /api/vm/info HTTP/1.1
        Host: kvm-eab0.local
        User-Agent: HomeAssistant/2025.7.1 aiohttp/3.12.13 Python/3.13
        Accept: application/json
        Accept-Encoding: gzip, deflate, br
        Cookie: nano-kvm-token=eyJhbGctokenR5cCI6IkpXVCJ9.eyJ1c2VybmFtZSI6tokenZXhwIjozMjg2NzAyfQ.liqHk-Pxn36yRLdltJ7_T4SsPPHlJxox7TsQ2rqaNsM
```

Tested the python library without HAS, using the following script - works as expected:

```
from aiohttp import ClientSession
import asyncio
from nanokvm.client import NanoKVMClient

async def test():
  async with ClientSession() as session:
    client = NanoKVMClient("http://192.168.1.249/api/", session)
    await client.authenticate("admin", "password")

    dev = await client.get_info()
    hw = await client.get_hardware()
    gpio = await client.get_gpio()
    print(dev,hw,gpio)

def main():
    loop = asyncio.get_event_loop()
    loop.run_until_complete(test())
    loop.close()

if __name__ == '__main__':
    main()

Output:
python3 test.py
{'ip': '192.168.1.249', 'mdns': 'kvm-eab0.local', 'image': 'v1.4.0', 'application': '2.2.5', 'deviceKey': 'e1c2491c1526b48e'} {'version': 'Beta'} {'pwr': True, 'hdd': False}
```

There is nothing specific in HAS logs.

**Comment by ivaniotchenko** [comment]
Configured logging, here is the output:
```
2025-07-08 19:42:42.911 DEBUG (MainThread) [nanokvm.client] Raw JSON response data: {'code': 0, 'msg': 'success', 'data': {'token': 'eyJtokenFtZSI6ImFkbWluIiwiZXhwIjozMjg4MDI4fQ.uVTxSilffv69shrGXjjNOEe1RdFgcKTtcZQcIvodo14'}}
2025-07-08 19:42:42.922 DEBUG (MainThread) [nanokvm.client] Got API response: code=<ApiResponseCode.SUCCESS: 0> msg='success' data=LoginRsp(token='eyJhbGtokenCJ9.eyJ1c2VybmFtZSI6ImFkbWluIiwiZXhwIjozMjg4MDI4fQ.uVTxSilffv69shrGXjjNOEe1RdFgcKTtcZQcIvodo14')
2025-07-08 19:42:42.926 DEBUG (MainThread) [nanokvm.client] Making API request: GET /vm/info (None)
2025-07-08 19:42:42.941 DEBUG (MainThread) [nanokvm.client] Raw JSON response data: {'code': 0, 'msg': 'success', 'data': {'ip': '192.168.1.249', 'mdns': 'kvm-eab0.local', 'image': 'v1.4.0', 'application': '2.2.5', 'deviceKey': 'e1c2491c1526b48e'}}
```

**Comment by ivaniotchenko** [comment]
Updated nanokvm app version to 2.2.9 -> got some changes. Attempts to add device by IP now ends up with "already_in_progress" error. However, autodiscovered mDNS name was successfully added. Still had connection error, something like "API returned -2 error". Using tcpdump I tracked last API call to be "GET /api/storage/image/mounted HTTP/1.1". Enabled virtual disk in NanoKVM and it did the trick - HAS was able to connect and control my kvm.
